[
  {
    "source_id": "nrc-reactor-status",
    "probed_at": "2026-08-25T16:50:00.000Z",
    "result": "success",
    "http_status": 200,
    "response_format": "text/plain; pipe-delimited",
    "record_count": 95,
    "identifiers": ["ReportDt", "Unit"],
    "rate_limit_behavior": "No published endpoint-specific limit found; poll once daily with conditional headers when exposed.",
    "empty_response_behavior": "Zero latest-day rows block publication.",
    "notes": "The adapter retains only rows for the latest report date while hashing the complete response."
  },
  {
    "source_id": "federal-register-nrc",
    "probed_at": "2026-08-25T16:50:00.000Z",
    "result": "success",
    "http_status": 200,
    "response_format": "application/json",
    "record_count": 1,
    "identifiers": ["document_number"],
    "rate_limit_behavior": "No rate limit was encountered; use one bounded daily incremental request.",
    "empty_response_behavior": "Zero new NRC documents is a valid unchanged check.",
    "notes": "FederalRegister.gov is discovery evidence. GovInfo verification remains required for dispositive legal claims."
  },
  {
    "source_id": "usaspending-nuclear",
    "probed_at": "2026-08-25T16:58:49.156Z",
    "result": "success",
    "http_status": 200,
    "response_format": "application/json",
    "record_count": 0,
    "identifiers": ["Award ID", "Last Modified Date"],
    "rate_limit_behavior": "No rate limit was encountered; use one bounded daily incremental request.",
    "empty_response_behavior": "Zero awards in the incremental time window is a valid unchanged check.",
    "notes": "The approved request uses the documented last_modified_date filter for contract award codes A through D. Award Start Date remains an effective date. Grants, loans, and other assistance require separate requests."
  },
  {
    "source_id": "grants-gov-nuclear",
    "probed_at": "2026-08-25T16:50:00.000Z",
    "result": "success",
    "http_status": 200,
    "response_format": "application/json",
    "record_count": 50,
    "identifiers": ["opportunityId", "opportunityNumber"],
    "rate_limit_behavior": "No rate limit was encountered; use one bounded daily snapshot request.",
    "empty_response_behavior": "Zero current opportunities is valid only when the response declares a complete result set.",
    "notes": "The current response returned a complete result set below the configured 100-record bound."
  },
  {
    "source_id": "osti-nuclear",
    "probed_at": "2026-08-25T16:52:00.000Z",
    "result": "success",
    "http_status": 200,
    "response_format": "application/json",
    "record_count": 100,
    "identifiers": ["osti_id", "doi"],
    "rate_limit_behavior": "No rate limit was encountered; automation remains unapproved until pagination is bounded.",
    "empty_response_behavior": "Zero search records may be valid, but pagination completeness must be proven first.",
    "notes": "The endpoint initially labeled its response as XML. An explicit Accept: application/json header produced a stable JSON contract."
  },
  {
    "source_id": "sec-edgar-oklo",
    "probed_at": "2026-08-25T16:50:00.000Z",
    "result": "blocked_auth",
    "http_status": null,
    "response_format": null,
    "record_count": null,
    "identifiers": ["CIK", "accessionNumber"],
    "rate_limit_behavior": "SEC fair-access limits require an identified User-Agent and bounded requests.",
    "empty_response_behavior": "Not tested because the required identified User-Agent is not configured.",
    "notes": "Set SEC_USER_AGENT to an application name and monitored contact before a live request."
  },
  {
    "source_id": "nrc-adams",
    "probed_at": "2026-08-25T16:50:00.000Z",
    "result": "blocked_auth",
    "http_status": null,
    "response_format": null,
    "record_count": null,
    "identifiers": ["docket number", "accession number"],
    "rate_limit_behavior": "The subscription contract and rate limits must be verified after access is granted.",
    "empty_response_behavior": "Not tested because the NRC subscription key is not configured.",
    "notes": "The adapter preflight blocked before network retrieval because NRC_ADAMS_SUBSCRIPTION_KEY is absent."
  },
  {
    "source_id": "govinfo-federal-register",
    "probed_at": "2026-08-25T16:50:00.000Z",
    "result": "blocked_auth",
    "http_status": null,
    "response_format": null,
    "record_count": null,
    "identifiers": ["packageId", "granuleId"],
    "rate_limit_behavior": "Verify the data.gov key quota before approving the legal-verification adapter.",
    "empty_response_behavior": "Not tested because DATA_GOV_API_KEY is absent.",
    "notes": "The date-path collection contract also needs a dedicated adapter."
  },
  {
    "source_id": "regulations-gov-nrc",
    "probed_at": "2026-08-25T16:50:00.000Z",
    "result": "blocked_auth",
    "http_status": null,
    "response_format": null,
    "record_count": null,
    "identifiers": ["documentId", "docketId"],
    "rate_limit_behavior": "Verify the data.gov key quota and honor 429 Retry-After responses.",
    "empty_response_behavior": "Not tested because DATA_GOV_API_KEY is absent.",
    "notes": "Docket-specific queries and pagination remain required before automation."
  },
  {
    "source_id": "sam-opportunities-nuclear",
    "probed_at": "2026-08-25T16:50:00.000Z",
    "result": "blocked_auth",
    "http_status": null,
    "response_format": null,
    "record_count": null,
    "identifiers": ["noticeId", "solicitationNumber"],
    "rate_limit_behavior": "Verify the SAM.gov key quota and honor 429 Retry-After responses.",
    "empty_response_behavior": "Not tested because SAM_GOV_API_KEY is absent.",
    "notes": "A solicitation may support procurement activity but never proves an award."
  },
  {
    "source_id": "eia-nuclear",
    "probed_at": "2026-08-25T16:50:00.000Z",
    "result": "blocked_auth",
    "http_status": null,
    "response_format": null,
    "record_count": null,
    "identifiers": ["plantId", "generatorId", "period"],
    "rate_limit_behavior": "Verify the EIA API key quota for each route before approval.",
    "empty_response_behavior": "Not tested because EIA_API_KEY is absent.",
    "notes": "Each route needs its own cadence, facets, pagination, and unit contract."
  },
  {
    "source_id": "ferc-electric",
    "probed_at": "2026-08-25T16:50:00.000Z",
    "result": "blocked_auth",
    "http_status": null,
    "response_format": null,
    "record_count": null,
    "identifiers": ["docket number", "accession number", "respondent ID"],
    "rate_limit_behavior": "Verify the FERC API key quota for each structured dataset before approval.",
    "empty_response_behavior": "Not tested because FERC_API_KEY is absent.",
    "notes": "eLibrary documents and structured data need separate adapters and authority scopes."
  }
]
